{
  "show": "Buffering",
  "season": 1,
  "episode": 1,
  "title": "The Pilot",
  "schema_version": "2.0",
  "dialogue_status": "present",
  "render": {
    "fps": 24,
    "resolution": [1280, 720]
  },
  "cast": {
    "maya": {
      "name": "Maya Chen",
      "role": "Lead engineer",
      "visual": "East Asian woman in her late 20s",
      "reference_images": [],
      "lora": null,
      "voice": {
        "provider": "text2speech",
        "voice_id": "maya_v1",
        "clone_from": "",
        "seed": 42,
        "temperature": 0.8,
        "language": "en"
      }
    }
  },
  "environments": {
    "living_room": {
      "trigger_word": "Modern apartment living room",
      "style": "cinematic, warm lighting"
    }
  },
  "scenes": [
    {
      "scene_id": "001",
      "title": "The Bug Discovered",
      "environment": "living_room",
      "characters_present": ["maya"],
      "mood": "tense",
      "beats": [
        {
          "beat_id": "001_b00",
          "kind": "silent",
          "camera": "wide establishing shot",
          "action": "Maya hunched over laptop",
          "seed": 1001
        },
        {
          "beat_id": "001_b01",
          "kind": "speech",
          "camera": "close-up on Maya",
          "action": "Maya stares at screen",
          "seed": 1002,
          "speaker": "maya",
          "text": "This can't be right."
        }
      ]
    }
  ]
}
